{
  "roundId": 20260418,
  "finalizedAt": "2026-04-19T01:32:39.047669+00:00",
  "submissionCount": 0,
  "submissionRoot": "0x0000000000000000000000000000000000000000000000000000000000000000",
  "logHash": "0x17d595afb39c66d05f9e4ca60b28fc582cb287f954dc6e53973f1a5329865550",
  "winnerA": "0x0000000000000000000000000000000000000000",
  "winnerA_id": "",
  "winnerB": "0x0000000000000000000000000000000000000000",
  "winnerB_id": "",
  "winnerC": "0x0000000000000000000000000000000000000000",
  "winnerC_id": "",
  "prizePerWinner": "7500000000000000000000000",
  "submissions": []
}