{
  "roundId": 20260409,
  "finalizedAt": "2026-04-09T00:04:58.863467+00:00",
  "submissionCount": 0,
  "submissionRoot": "0x0000000000000000000000000000000000000000000000000000000000000000",
  "logHash": "0x8b4f3279c9b42cd4840ca66bd2a9842dc372c42ce3b9002fcd466574fd65e552",
  "winnerA": "0x0000000000000000000000000000000000000000",
  "winnerA_id": "",
  "winnerB": "0x0000000000000000000000000000000000000000",
  "winnerB_id": "",
  "winnerC": "0x0000000000000000000000000000000000000000",
  "winnerC_id": "",
  "prizePerWinner": "0",
  "submissions": []
}