{
  "roundId": 20260322,
  "finalizedAt": "2026-03-22T09:04:35.560356+09:00",
  "submissionCount": 0,
  "submissionRoot": "0x0000000000000000000000000000000000000000000000000000000000000000",
  "logHash": "0xdf099816de7226ed7589ac6a3589b0e3beff5ef2002c86028e817bfba9abd2ba",
  "winnerA": "0x0000000000000000000000000000000000000000",
  "winnerA_id": "",
  "winnerB": "0x0000000000000000000000000000000000000000",
  "winnerB_id": "",
  "winnerC": "0x0000000000000000000000000000000000000000",
  "winnerC_id": "",
  "prizePerWinner": "",
  "submissions": []
}