{
  "roundId": 20260330,
  "finalizedAt": "2026-03-30T09:00:35.131701+09:00",
  "submissionCount": 0,
  "submissionRoot": "0x0000000000000000000000000000000000000000000000000000000000000000",
  "logHash": "0x5cbb1cc9947be8a20a6f5450b809070015df6b18dc54bfeae89410d6e3187b92",
  "winnerA": "0x0000000000000000000000000000000000000000",
  "winnerA_id": "",
  "winnerB": "0x0000000000000000000000000000000000000000",
  "winnerB_id": "",
  "winnerC": "0x0000000000000000000000000000000000000000",
  "winnerC_id": "",
  "prizePerWinner": "0",
  "submissions": []
}