{
  "roundId": 20260415,
  "finalizedAt": "2026-04-16T00:20:12.944570+00:00",
  "submissionCount": 0,
  "submissionRoot": "0x0000000000000000000000000000000000000000000000000000000000000000",
  "logHash": "0x904d8d573052f2cf9bd6853e8d6fa22a00718c9173fb4a92c141daa234e2b48f",
  "winnerA": "0x0000000000000000000000000000000000000000",
  "winnerA_id": "",
  "winnerB": "0x0000000000000000000000000000000000000000",
  "winnerB_id": "",
  "winnerC": "0x0000000000000000000000000000000000000000",
  "winnerC_id": "",
  "prizePerWinner": "0",
  "submissions": []
}