{
  "roundId": 20260413,
  "finalizedAt": "2026-04-14T00:07:00.296283+00:00",
  "submissionCount": 0,
  "submissionRoot": "0x0000000000000000000000000000000000000000000000000000000000000000",
  "logHash": "0x0c8b2219ccd67615e8f80a79b265b80e4d69c901eaa47ebe3f2a163240dba8de",
  "winnerA": "0x0000000000000000000000000000000000000000",
  "winnerA_id": "",
  "winnerB": "0x0000000000000000000000000000000000000000",
  "winnerB_id": "",
  "winnerC": "0x0000000000000000000000000000000000000000",
  "winnerC_id": "",
  "prizePerWinner": "",
  "submissions": []
}