{
  "roundId": 20260320,
  "finalizedAt": "2026-03-20T09:05:50.882227+09:00",
  "submissionCount": 0,
  "submissionRoot": "0x0000000000000000000000000000000000000000000000000000000000000000",
  "logHash": "0x6231be338d770da3094f72f4a9a0f1947e56c3ab8c2eb959d53d1b064b13cb78",
  "winnerA": "0x0000000000000000000000000000000000000000",
  "winnerA_id": "",
  "winnerB": "0x0000000000000000000000000000000000000000",
  "winnerB_id": "",
  "winnerC": "0x0000000000000000000000000000000000000000",
  "winnerC_id": "",
  "prizePerWinner": "",
  "submissions": []
}