{
  "roundId": 20260419,
  "finalizedAt": "2026-04-20T01:35:00.744326+00:00",
  "submissionCount": 0,
  "submissionRoot": "0x0000000000000000000000000000000000000000000000000000000000000000",
  "logHash": "0xa7fae08c8fdac8b13566a29fbd2b94c2e9820bcdf7151ae38cfcd754e67759d7",
  "winnerA": "0x0000000000000000000000000000000000000000",
  "winnerA_id": "",
  "winnerB": "0x0000000000000000000000000000000000000000",
  "winnerB_id": "",
  "winnerC": "0x0000000000000000000000000000000000000000",
  "winnerC_id": "",
  "prizePerWinner": "7500000000000000000000000",
  "submissions": []
}