{
  "roundId": 20260407,
  "finalizedAt": "2026-04-07T00:03:00.317658+00:00",
  "submissionCount": 0,
  "submissionRoot": "0x0000000000000000000000000000000000000000000000000000000000000000",
  "logHash": "0x0eb481a86602e19b399813290390d13b058b0532250dbca0818301ca84fc0090",
  "winnerA": "0x0000000000000000000000000000000000000000",
  "winnerA_id": "",
  "winnerB": "0x0000000000000000000000000000000000000000",
  "winnerB_id": "",
  "winnerC": "0x0000000000000000000000000000000000000000",
  "winnerC_id": "",
  "prizePerWinner": "",
  "submissions": []
}