{
  "roundId": 20260404,
  "finalizedAt": "2026-04-04T00:00:38.021245+00:00",
  "submissionCount": 0,
  "submissionRoot": "0x0000000000000000000000000000000000000000000000000000000000000000",
  "logHash": "0x75b1183b62cdb0ef5a407636d399ef28cfc6d9afce181685273a601ff0b74806",
  "winnerA": "0x0000000000000000000000000000000000000000",
  "winnerA_id": "",
  "winnerB": "0x0000000000000000000000000000000000000000",
  "winnerB_id": "",
  "winnerC": "0x0000000000000000000000000000000000000000",
  "winnerC_id": "",
  "prizePerWinner": "0",
  "submissions": []
}