{
  "roundId": 20260402,
  "finalizedAt": "2026-04-02T09:00:48.052568+09:00",
  "submissionCount": 0,
  "submissionRoot": "0x0000000000000000000000000000000000000000000000000000000000000000",
  "logHash": "0x6449970910f082c0744a4284b4d84498c72c807c508af2b17daa8b02dc3d95e8",
  "winnerA": "0x0000000000000000000000000000000000000000",
  "winnerA_id": "",
  "winnerB": "0x0000000000000000000000000000000000000000",
  "winnerB_id": "",
  "winnerC": "0x0000000000000000000000000000000000000000",
  "winnerC_id": "",
  "prizePerWinner": "0",
  "submissions": []
}